{
  "task_id": "example-0001",
  "repo_url": "https://github.com/some-org/some-small-repo",
  "base_commit": "a1b2c3d4e5f6",
  "issue_title": "ValueError raised when parsing empty config file",
  "issue_body": "When config.yaml is empty, load_config() throws a raw ValueError instead of returning default settings. Expected: should fall back to DEFAULT_CONFIG.\n\nSteps to reproduce:\n1. touch config.yaml\n2. load_config('config.yaml')\n3. Traceback...",
  "gold_patch_url": "https://github.com/some-org/some-small-repo/commit/abc123",
  "test_command": "pytest tests/test_config.py -k test_empty_config_falls_back_to_default",
  "fail_to_pass_tests": [
    "tests/test_config.py::test_empty_config_falls_back_to_default"
  ],
  "pass_to_pass_tests": [
    "tests/test_config.py::test_valid_config_loads",
    "tests/test_config.py::test_missing_file_raises"
  ],
  "difficulty_notes": "Easy — single function, clear repro steps, one test file to touch. Good sanity-check task."
}
